{
  "public_contract_version": "0.3",
  "run_id": "run.thermal_reference_002",
  "source_model": "model.thermal_reference",
  "task": "task.stationary_thermal",
  "analysis": "analysis.stationary",
  "requested_observations": [
    "observation.maximum_temperature"
  ],
  "observation_outcomes": [
    {
      "status": "not_produced",
      "observation": "observation.maximum_temperature",
      "diagnostics": [
        {
          "code": "result.observation_not_produced",
          "severity": "error",
          "subject": "observation.maximum_temperature",
          "detail": "Requested observation was not produced."
        }
      ]
    }
  ]
}
